Company Name,Location,Owner,Email,Phone,Address,Website,Founded,Industry,Services,Notes,
PRECISION TURNING INC,SAUGUS,Gary T. Siedlik,info@preciseturning.com,,,http://www.preciseturning.com/,3 people ,Turning/Machining,,,
ARSENAULT PRECISION LLC,LEOMINSTER,Gerald J. Arsenault,,,52 Old Willard Rd. Leominster MA 01453,,,Precision Manufacturing,Wire EDM shop with 39 years experience of mold making specializing in 4 axis wire edming of collapsible cores,Custom manufacturing capabilities,
MACHINING FOR ELECTRONICS INC,BOLTON,,,(978) 562-7554,4 Bigelow St Hudson MA 01749,machiningforelectronics.com,,Electronics Machining,Precision parts microwave flanges aerospace computer filter industries fax (978) 562-9287,60+ years in business - actual location Hudson MA not Bolton,
D & D PRECISION MACHINE COMPANY INC.,MIDDLEBORO,David DeMoranville,,(508) 946-8010,395 Plymouth Street Middleboro MA 02346,ddprecisionmachineinc.com,2003,Precision Machining,Centerless Grinding CNC Machining Milling Turning,President 23000 sq ft facility 25 employees ISO 9001-2015 certified,
B & D PRECISION INC,STONEHAM,Dennis Dillon,,(781) 438-8644,41 Elm Street # 7 Stoneham MA 02180,,Tool & Die/Precision Manufacturing,Precision micro TIG and micro laser welding repair and machining,30+ years design experience 15+ years solid modeling,,
A B & D MACHINING INC,BELMONT,,,(617) 489-2284,50 Concord Ave Belmont MA 02478,,1985,Machining,Custom parts manufacturing prototyping and production runs,5-10 employees fax (617) 489-2285,
Email dan@axiscncinc.net
PINPOINT PRECISION,LUDLOW,,,,,,,Precision Manufacturing,,USDOT 3684618 - limited contact information found,
808 CNC INC.,HUNTINGTON,,,,,,,CNC Machining,,No information found in public records - possible confusion with Zrate CNC at 808 Main St Fitchburg MA,
BROOKS PRECISION MACHINING INC,CHELMSFORD,Charles B. Brooks,chuck@brooks-machine.com,(978) 256-7477,4 Kidder Road Chelmsford MA 01824,www.brooks-mfg.com,,Precision Machining,Machine Shop Jobbing and Repair 40 years in operation,~$1.9 million annual revenue ~10 employees,
NUMERIC MACHINING CO INC,WESTFIELD,,,,,195 Wayside Ave West Springfield MA 01089,,25 years,Machining,CNC milling turning commercial medical parts 4 HAAS machining centers 5 employees,Actually located in West Springfield not Westfield
MB MACHINING INC,WESTBOROUGH,Darren Bullen - Principal,,(508) 251-8663,245 Flanders Rd Westborough MA 01581,mbmachining.net,,Machining,CNC machining aerospace automotive medical dental ~2-5 employees,4 years in operation industrial machinery repair,
ZRATE CNC LLC,FITCHBURG,,,,,,,CNC Services,,,
L G M TOOLING CO INC,MERRIMAC,Leonard Mattos - President,lenmattos52@gmail.com,(978) 771-2595,71 West Main St Merrimac MA 01860,lgmtooling.com,1984,Tooling,Precision tool making CNC milling turning grinding The Original Swiveler Flag Pole manufacturer 6 employees,M-F 9am-5pm 3500 sq ft facility,
Phone: (413) 461-5355
Colin Chrabaszcz  Operations manager
N C PRECISION LLC,NORTH BILLERICA,,,(978) 528-3177,34 Sylvan Rd Billerica MA 01821,ncprecision.com,,Precision Manufacturing,CNC sliding head turning 0.5-35mm diameter stainless steel titanium aluminum 20+ years experience,Ultrasonic cleaning magnetic deburring lapping services,
STERLING PRECISION LLC,CLINTON,Acquired by Vitesse Systems,See contact,See contact,90 Parker St Clinton MA 01510,sterlingprecisioninc.com,See notes,Precision Manufacturing,CNC machining aluminum dip brazing aerospace military industries - acquired by Vitesse Systems,Young aggressive manufacturing company 10+ years manufacturing excellence,
JACOBS PRECISION CORP,AVON,Ralph S Jacobs,info@jacobsprecision.com,(508) 588-2121,21 Ledin Drive Avon Industrial Park MA 02322,jacobsprecision.com,,Precision Manufacturing,CNC Swiss screw machine precision components military medical dental aerospace electronics,Fax (508) 588-2144 fiber optics machine tools microwave communications,
MAGICHANICS PRECISION INC,NEWTON CENTER,,,,,,,Precision Manufacturing,,No information found in public records or business listings,
EASTHAMPTON PRECISION MANUFACTUR ING INC,EASTHAMPTON,Jeremy Segal (Owner),epm-eqm@epm-eqm.com,See contact,DBA Easthampton Quality Machine,,Precision Manufacturing,Aerospace Defense Firearms Gauging Commercial Products,DBA Easthampton Quality Machine - 8 mills 3 lathes CNC Swiss machines LinkedIn: linkedin.com/in/jeremy-segal-162226b,,
PRECISION DESIGN ENGINEERING CORP,WAREHAM,Ron Gerace (President),info@pdewareham.com,(508) 273-9911,10 Kendrick Road STE 6 Wareham MA 02571,precisiondesignengineering.com,2019,Design Engineering,Technology-enabled advanced CNC manufacturing for military marine medicine ISO 9001:2015 certified,5-10 employees $5-10M revenue founded 2019 by acquiring and merging two engineering firms,
VAN PELT PRECISION INC,THREE RIVERS,,,,,,,Precision Manufacturing,,,
PRECISION COMPONENTS GROUP INC.,SPRINGFIELD,Peter A Elias,peterelias@pcgmfg.com,http://www.pcgmfg.com/contact.html,(413) 333-4184,190 Doty Cir West Springfield MA 01089,,Machining,Components,Aerospace products and parts manufacturing precision machining 3 employees $174K revenue,Located in West Springfield part of greater Springfield area
MAGICHANICS PRECISION INC,STOW,,,,,,,Precision Manufacturing,,No information found in public records or business listings - may be duplicate entry,
TALCO CNC SOLUTIONS INC,INDIAN ORCHARD,Thomas LeMay (Owner/CEO),See website,See contact,34 Front St Indian Orchard MA 01151 PO Box 51973,talcocnc.com,2013,CNC Solutions,Exclusive importer Spinner Machinery USA distributor Eurotech Swiss machines New England CNC repair sales training,4 staff members $387K revenue,
PRECISION BILLET INC,GRANBY,Robin D. Giroux,,(413) 255-0183,148 Porter Street Granby MA 01033,,2012,Precision Billet,Design Services,~$282633 annual revenue ~3 staff,
TMH MACHINING & WELDING CORP,WEST BRIDGEWATER,Tony Hruzd,,(508) 580-6899,https://tmhmachine.com/,https://tmhmachine.com/about-us,"More than 12 people, not ideal",Machining/Welding,,,
RM PRECISION MACHINE COMPANY. INC,TEWKSBURY,Richard MacDonald (President),See website,(978) 640-2900,120 Lumber Lane Unit 7 Tewksbury MA 01876,rmprecision.com,1992,Precision Machining,CNC milling turning shop quality machined parts mechanical assemblies medical computer semi-conductor,DUPLICATE ENTRY - 4 employees fax (978) 640-2992,
Phone: (413) 687-0848
AUTUMN PRECISION LLC,WESTHAMPTON,Mark Gould,,,,,,Precision Manufacturing,,No information found in public records - may be UK-based company Autumn Precision Engineering Ltd,
STD PRECISION GEAR & INSTRUMENT INC,WEST BRIDGEWATER,James Manning (Owner),See website,(508) 580-0035,318 Manley Street West Bridgewater MA 02379,stdgear.com,1986,Precision Gear/Instruments,High precision AGMA Q14 complexly configured tightly toleranced gears splines mechanical transmission components,25 employees AS9100 ISO 9001 Nadcap accredited NASA ISS Hubble telescope projects fax (508) 580-0071,
ATLAS PP MACHINING,LOWELL,Carlos Castro,atlasppmachining@gmail.com,(978) 967-9815,50 Foot Off Crosby St Lowell MA 01852,atlasmachininginc.com,2016,Machining,CNC milling and CNC lathe/turning services for oil and gas automotive aerospace medical electronic mining power plants steel and paper mills shipbuilding,35+ years experience,
D&D PRECISION MACHINE COMPANY INC,MIDDLEBORO,David DeMoranville,,(508) 946-8010,395 Plymouth Street Middleboro MA 02346,ddprecisionmachineinc.com,2003,Precision Machining,Centerless Grinding CNC Machining Milling Turning,President 23000 sq ft facility 25 employees ISO 9001-2015 certified DUPLICATE ENTRY,
INIRAM PRECISION MACHINE TOOL INC.,WALTHAM,,,(978) 854-3037,42 Felton Street Unit 8R Waltham MA 02453,iniram.com,,Precision Machine Tools,Advanced precision machining technology HAMUEL HERMLE exclusive North American importer,DUPLICATE ENTRY - 3 employees $3M revenue,
Email glenn@axiscncinc.net
BENCO PRECISON MACHINING INC,GLOUCESTER,Ron Benjamin,See contact,(978) 281-2055,10 Pond Rd # B Gloucester MA 01930,,1988,Precision Machining,Machine Shops Automobile Machine Shop,35 years in business 6 employees BBB A+ rating fax (978) 281-3788,
COMMAND PRECISION INC,BURLINGTON,,info@Persistent.id,(888) 367-6911,100 Summit Drive Suite 100 Burlington MA 01803,commandprecision.com,,Data Solutions,Identity and Intent data solutions,Data company not traditional machining,
VALCO PRECISION MACHINE INC,BROCKTON,John Mascheri,admin@valcoprecisionmachine.com ,+1 (508) 559-9009,"800 West Chestnut Street, Brockton MA 02301 ",https://valcoprecisionmachine.com/rfq/,"Not sure how any people, but at most 5",Precision Machining,,,
AP PRECISION MACHINE INC,HOLLISTON,Family-owned,Sales@ap-pmi.com,(508) 384-5081,210 Kuniholm Dr. BLD #2 STE #1 Holliston MA 01746,ap-pmi.com,,Precision Machining,18+ years in CNC manufacturing industry family-owned and operated,When you contact them you speak directly with the owner,
PRECISION DIGITAL CORP,HOPKINTON,Jeffrey Peters,(508) 655-7300,(508) 655-7300,233 South St Hopkinton MA 01748,www.predig.com,1974,Digital display and control instrumentation,Industrial processes worldwide,,
J. P. PRECISION MACHINE CO INC,CHICOPEE,Judy A Poetz - Owner,,(413) 594-4193,25 Grape St Chicopee MA 01013,,,Precision Machining,Aerospace and defense industries manufacturing and assembly,44 years woman-owned precision manufacturing shop,
FILTEC PRECISION CERAMICS CORPORATION,WESTFORD,,,(978) 692-6336,2 Technology Park Drive Westford MA 01886,,,Precision Ceramics,Co-fired and high temperature ceramic technologies piezoelectric ceramics,DUPLICATE ENTRY - Advanced ceramic technologies,
TATTERSALL MACHINING INC,UPTON,Bruce Tattersall (Owner),See website,(508) 529-2300,190 Milford Street Upton MA 01568,tattersallmachining.com,,Machining,CNC lathe milling machining prototype to production runs 13 employees $1.8M revenue,35+ years in business fax (508) 529-6634,
ADVANCED PRECISION ENGINEERING INC,IPSWICH,,info@ape10.com,(978) 356-7303,16 Mitchell Road Ipswich MA 01938,www.ape10.com,,Precision Engineering,Machining and assembly manufacturing for defense medical optics robotics semiconductor,ISO AS9100D 9001:2015 ITAR registered,
ATLAS PP MACHINING INC,LOWELL,Carlos Castro,atlasppmachining@gmail.com,(978) 967-9815,50 Foot Off Crosby St Lowell MA 01852,atlasmachininginc.com,2016,Machining,Well-equipped machine shop precision prototype and production manufacturing CNC services,Founded by Carlos Castro with 35+ years CNC experience - duplicate entry,
DRC PRECISION MACHINING CO INC,STONEHAM,John Darcy,,(781) 438-4500,74 Maple St Ste B Stoneham MA 02180,,1988,Precision Machining,Cutlery and Handtool Manufacturing,3 employees $220376 annual sales,
WHALLEY PRECISION INC,SOUTHWICK,David Whalley,info@whalleyprecision.com,(413) 569-1400,28 Hudson Drive Southwick MA 01077,www.whalleyprecision.com,1990,Precision Manufacturing,Precision manufacturing services difficult to machine hi-temp & super-alloys like Inconel Monel Kovar & MP35N,AS9100D/ISO 9001:2015 & FAA/EASA certified family-owned 34+ years,
PRECISION COATING COMPANY LLC,HUDSON,Bill Ellerkamp - President,everrill@precisioncoating.com,(978) 562-7561,51 Parmenter Rd Hudson MA 01749,precisioncoating.com,,Coating Services,Medical device coatings guide wires surgical instruments orthopedic implants 201 employees $75M revenue,Recently acquired by Integer Holdings Corp Jan 2025 - 5 facilities MA RI Costa Rica,
CUSTOM PLASTICS MACHINING INC.,WOBURN,Daniel Smith,,(781) 937-9700,9 Presidential Way Ste D Woburn MA 01801,,1999,Plastics Machining,Machine Shop Jobbing And Repair,CEO Daniel Smith,
Glenn Larzazs   Vice President / Office manager
BAYSIDE MACHINING SERVICE INC.,MATTAPOISETT,,,,,,,Machining Services,,,
G & W PRECISION INC,WHATELY,,,,,199c Long Plain Rd PO Box 203 Whately MA 01093,,,Precision Manufacturing,Plastic injection & silicone molds general machining injection molding & repair,Supplier of plastic injection molds
HELBLING PRECISION ENGINEERING INC,CAMBRIDGE,Sebastian Beck - Director Cole Constantineau - Coordinator,,(617) 475-1560,14 Broadway Cambridge MA 02142,helblingusa.com,,Precision Engineering,MedTech robotics lab systems product development prototyping surgical instruments,29 employees part of Helbling Technik 600+ engineers worldwide,
MACHINING TECHNOLOGIES LLC,WEBSTER,,sales@machiningtechllc.com,(508) 943-1824,4 Goya Dr Webster MA 01570,machiningtechllc.com,1985,Machining Technologies,High volume Hydromat operations CNC milling turning firearm parts 70000 sq ft facility,Largest contract Hydromat operation in northeastern US,
",(413) 657-6908,39 Gould Rd Ware MA 01082,www.axiscncinc.net,2011,CNC Machining,Advanced manufacturing machining and programming services rapid prototyping short-run and high-volume machining,14 employees serving Central/Western MA since 2011 family-owned by Daniel and Glenn Larzazs,
SHATTUCK PRECISION MACHINING COMPANY INC,WESTFORD,Dale Shattuck (Owner),daleshattuck@verizon.net,(978) 392-0848,2 Park Dr Suite 7 Westford MA 01886,shattuck-precision.com,1999,Precision Machining,Crafting custom parts various metal types AutoCAD Iges drawing formats high-tech industry,4 employees $213K revenue fax (978) 392-0874 established 1999/1985,
PRECISION MACHINISTS COMPANY INC.,CHELMSFORD,Dirk Kuyper (President),janice@precisionmachinists.net,(978) 256-4592,299 Littleton Road Chelmsford MA 01824,precisionmachinists.net,1973,Machining,Custom precision CNC machining services prototyping high volume production 7 employees,DUPLICATE ENTRY - ISO9001 AS9100C ITAR certified aerospace defense semiconductor medical,
AMERICAN FLOWFORM & MACHINING LLC,BILLERICA,WAY TOO BIG – but they are hiring like mad,DCorga@Americanflowform.com,(978) 667-0202,12 Suburban Park Drive Billerica MA 01821,www.americanflowform.com,,Flowform/Machining,World leader in advanced cold metal forming of precision components for military aerospace oil/gas,,
TOOLING RESEARCH INC,WALPOLE,See contact,See website,See contact,81 Diamond St Walpole MA 02081 PO Box 306,tooling-research.com,1983,Tooling Research,Engineering automation research design development manufacturing medical robotics marine chemical handling Valcom division,1-10 employees in business since 1983,
AXIS CNC INCORPORATED,WARE,Daniel Larzazs (President),"Dan Larzazs     President / Sales manager
WACHUSETT PRECISION TOOL INC,FITCHBURG,Matthew Saunders (Co-Owner),See website,(978) 343-6443,830 Westminster St Fitchburg MA 01420,wachusettprecisiontool.com,2016,Precision Tools (Bought out),Concept to Production medical products devices complex packaging prototype pilot class 101 production molds,7 employees $1-5M revenue alt phone (978) 400-7119,
AA PRECISION MACHINE CO INC,FALL RIVER,Arthur Arruda,??@aaprecisionmachine.com,(508) 673-1698,300 Currant Rd Fall River MA 02720,aaprecisionmachine.com,1966,Precision Machining,CNC machining milling turning drilling grinding welding precision molds CAD/CAM services,,
PRECISION AEROSPACE COMPONENTS INC.,GROVELAND,Jim Granitsas,jgranitsas@precisionaerospace.net,(781) 856-7094,678 Salem St Groveland MA 01834,precisionaerospace.net,1998,Aerospace Components,Manufacturer's rep precision gears complex machining aerospace defense OEM suppliers,DUPLICATE ENTRY - Custom build-to-print gears since 1998,
PRECISION OPTICS CORPORATION INC,GARDNER,Publicly-traded NASDAQ: POCI,sales@poci.com,(978) 630-1800,22 East Broadway Gardner MA 01440,www.poci.com,1982,Precision Optics,Advanced optical instruments medical instruments micro-optics assemblies advanced optical systems,40+ years publicly traded,
FILTEC PRECISION CERAMIC CORP,WESTFORD,,,(978) 692-6336,2 Technology Park Drive Westford MA 01886,,,Precision Ceramics,Co-fired and high temperature ceramic technologies piezoelectric ceramics,Advanced ceramic technologies for industrial applications,
PRECISION MACHINISTS COMPANY INC,CHELMSFORD,Dirk Kuyper (President),dirk@precisionmachinists.net,(978) 256-4592,299 Littleton Road Chelmsford MA 01824,precisionmachinists.net,1973,Machining,Custom precision CNC machining services prototyping high volume production 7 employees,ISO9001 AS9100C ITAR certified aerospace defense semiconductor medical device industries,
MOHAWK PRECISION INC.,WARE,,,,,,,Precision Manufacturing,,No information found in public records - no business listings found,
ETNA MACHINING INC.,DRACUT,,,,,,,Machining,,No information found in public records - Mill City Precision Machine operates in Dracut area,
SWISS PRECISION PRODUCTS INC,NORTH OXFORD,See website,See website,See contact,627 Main Street North Oxford MA 01537,swissprpr.com,,Swiss Precision Products,VetVu brand veterinary endoscope video equipment accessories trusted since 1970s Schott fiberoptics,LinkedIn 25 followers specializes in crafting veterinary endoscopes,
UNITED MACHINING INC,SUTTON,Dylan Polseno (Co-Owner),dylan@unitedmachining.us,(508) 865-3035,219 Whitins Road Unit 5 Sutton MA 01590,unitedmachining.us,,Machining,Swiss Turning/Milling CNC Machine Shop aerospace agriculture automotive defense fiber optics consumer products,One man shop Mon-Fri 8am-4pm also at 12 Westview Dr,
GUTTEMBERG PRECISION MACHINING INC.,BEVERLY,,,,,,,Precision Machining,,No information found in public records - possible name confusion with Iowa company,
TRUE PRECISION INDUSTRIES INC,WEST SPRINGFIELD,Richard Champigny,rchampigny@trueprecisionind.com,413-788-4226,"17 Allston Ave, West Springfield, MA 01089, United States",https://www.facebook.com/trueprecisionind/,,Precision Industries,,,
CARTESIAN CNC INC.,WINCHESTER,,,,,,,CNC Machining,,No information found in public records - no online presence or business listings found,
RESEARCH PRECISION INSTRUMENTS COMPANY INC,NATICK,Charles Felts,info@rpico.com,,,,"Likely too big, imaging focused",Research Instruments,,,
DIMARK PRECISION MACHINING,PEMBROKE,James Porter - President,,(781) 826-6157,745 Washington Street Pembroke MA 02359,dimarkprecision.com,1992,Precision Machining,Quality precision machining & finishing job shop,14 employees 8400 sq ft facility acquired Radii Precision in 2010,
KMAC MACHINING LLC,BROCKTON,,,,,,,Machining,,No information found in public records - no online presence or business listings,
CONCEPT MACHINING INC,NORTH BILLERICA,Robert Bob Volpe,bob@conceptmachininginc.com,(978) 663-4999,25 Sullivan Road North Billerica MA 01862,conceptmachininginc.com,2000,Machining,Production and Prototype Machine Shop specializing in Milling and Turning,State-of-the-art facilities 3-5 staff,
INDUSTRIAL PRECISION INC,WESTFIELD,Douglas Smith Steve Hitchcock - VP,,(413) 562-5161,1014 Southampton Rd Westfield MA 01085,industrialprecision.com,,Industrial Precision,Aviation aerospace component manufacturing industrial machinery equipment,22 employees $16M revenue 24 hour operation,
FRAEN MACHINING SRL HOLDING CORPORATION,READING,,,,,,,Machining Holdings,,,
J. P. PRECISION MACHINE CO. INC.,CHICOPEE,Judy A Poetz - Owner,,(413) 594-4193,25 Grape St Chicopee MA 01013,,,Precision Machining,Aerospace and defense industries manufacturing and assembly,DUPLICATE ENTRY - 44 years woman-owned,
PRECISION MANUFACTURING LLC,LOWELL,George Sharpe,Precisionmfg@comcast.net,978-452-5345,,https://precisionmanufacturingllc.com/mission-statement/,,Manufacturing,,,
